{"schema":"pathlab.ai-pack/2","packId":"special-stain-descriptive-v2","version":"2.0.0","capability":"special-stain-descriptive","scope":"deployment","activationEligible":true,"acceptedStains":["pas","pas_d","trichrome","gms","afb","generic_brightfield"],"preprocessing":{"id":"brightfield-stain-v2","tilePixels":512},"artifacts":[],"runtimeCompatibility":{"workerProtocol":"pathlab.model-worker-result/2","executionProvider":"cpu","cuda":"none","gpuArchitecture":"none","requiresExternalWorker":false,"segmentMaxSeconds":120},"licenseLedger":[{"component":"PathLab special stain descriptors","kind":"code","license":"PathLab repository license","revision":"2.0.0","permittedUse":"private-research","redistributable":false,"derivativesAllowed":true}],"derivativePermissions":{"atlasResearch":true,"atlasClean":true,"reviewedAt":"2026-08-22T00:00:00Z"},"resourceEnvelope":{"lane":"cpu_io","maxRamMiB":1024,"maxVramMiB":0,"maxSeconds":120,"network":false},"qualificationPolicy":{"requiresSignedAttestation":true,"protocolSha256":"d035efcec9812f16464b4e8e59e9d245884a57698626821ab0cf056d05854cee"},"outputSchema":"pathlab.model-qualification-report/2","markers":[]}
