{"schema":"pathlab.ai-pack/2","packId":"cell-od-watershed-v2","version":"2.0.0","capability":"cell-morphology","scope":"deployment","activationEligible":true,"acceptedStains":["he","ihc_dab","papanicolaou"],"preprocessing":{"id":"od-watershed-v2","tilePixels":512},"artifacts":[],"runtimeCompatibility":{"workerProtocol":"pathlab.model-worker-result/2","executionProvider":"cpu","cuda":"none","gpuArchitecture":"none","requiresExternalWorker":false,"segmentMaxSeconds":120},"licenseLedger":[{"component":"PathLab OD watershed","kind":"code","license":"PathLab repository license","revision":"2.0.0","permittedUse":"private-research","redistributable":false,"derivativesAllowed":true}],"derivativePermissions":{"atlasResearch":true,"atlasClean":true,"reviewedAt":"2026-08-22T00:00:00Z"},"resourceEnvelope":{"lane":"cpu_io","maxRamMiB":1024,"maxVramMiB":0,"maxSeconds":120,"network":false},"qualificationPolicy":{"requiresSignedAttestation":true,"protocolSha256":"dd251775f0abe6a780b2389ee489f18bcec78b9cb80e1facfd7134a05cb0c2a0"},"outputSchema":"pathlab.model-qualification-report/2","markers":[]}
