{"schema":"pathlab.ai-pack/2","packId":"ihc-descriptive-v2","version":"2.0.0","capability":"ihc-descriptive","scope":"deployment","activationEligible":true,"acceptedStains":["ihc_dab"],"preprocessing":{"id":"hdab-relative-v2","tilePixels":512},"artifacts":[],"runtimeCompatibility":{"workerProtocol":"pathlab.model-worker-result/2","executionProvider":"cpu","cuda":"none","gpuArchitecture":"none","requiresExternalWorker":false,"segmentMaxSeconds":120},"licenseLedger":[{"component":"PathLab deterministic H-DAB measurement","kind":"code","license":"PathLab repository license","revision":"2.0.0","permittedUse":"private-research","redistributable":false,"derivativesAllowed":true}],"derivativePermissions":{"atlasResearch":true,"atlasClean":true,"reviewedAt":"2026-08-22T00:00:00Z"},"resourceEnvelope":{"lane":"cpu_io","maxRamMiB":2048,"maxVramMiB":0,"maxSeconds":120,"network":false},"qualificationPolicy":{"requiresSignedAttestation":true,"protocolSha256":"9b2d3299eed5504fe7d89839cacae6ea5232762d6405bdfab261ad78e30b991f"},"outputSchema":"pathlab.model-qualification-report/2","markers":["generic","er","pr","ki-67","her2","pd-l1"]}
