{"schema":"pathlab.ai-pack/2","packId":"cytology-descriptive-v2","version":"2.0.0","capability":"cytology-descriptive","scope":"deployment","activationEligible":true,"acceptedStains":["papanicolaou","generic_brightfield"],"preprocessing":{"id":"papanicolaou-descriptive-v2","tilePixels":512},"artifacts":[],"runtimeCompatibility":{"workerProtocol":"pathlab.model-worker-result/2","executionProvider":"cpu","cuda":"none","gpuArchitecture":"none","requiresExternalWorker":false,"segmentMaxSeconds":120},"licenseLedger":[{"component":"PathLab cytology descriptors","kind":"code","license":"PathLab repository license","revision":"2.0.0","permittedUse":"private-research","redistributable":false,"derivativesAllowed":true}],"derivativePermissions":{"atlasResearch":true,"atlasClean":true,"reviewedAt":"2026-08-22T00:00:00Z"},"resourceEnvelope":{"lane":"cpu_io","maxRamMiB":1024,"maxVramMiB":0,"maxSeconds":120,"network":false},"qualificationPolicy":{"requiresSignedAttestation":true,"protocolSha256":"b354e6c605afc55b5663167453fa2b23738f311d48de5f30293cef0ba26f962a"},"outputSchema":"pathlab.model-qualification-report/2","markers":[]}
